{
  "$schema": "../../schemas/defaults/defaults.schema.json",
  "schemaVersion": "1.0",
  "name": "DDE well-known defaults",
  "description": "Fit-for-purpose defaults for well-understood study content, used by the defaults loader (pipeline stage F) to fill values no other loader supplied. They are specification values: the define.xml at this stage is built from the study design before data exist, so a length is an estimate to be set from the data at submission. Each entry's description gives its basis; see data/defaults/README.md. Sponsors may change, override or remove any entry.",
  "items": [
    {"name": "STUDYID", "description": "Computed (length of the study name); Convention. From #1 (length 7).", "values": {"length": {"lengthOf": "studyName"}, "origin": [{"type": "Protocol", "source": "Sponsor"}]}},
    {"name": "DOMAIN", "description": "SDTMIG; Convention. From #2.", "values": {"length": 2, "origin": [{"type": "Assigned", "source": "Sponsor"}]}},
    {"name": "USUBJID", "description": "Computed + Estimate (study name, two separators, 3-character site, 4-character subject); Convention. From #3 (length 14).", "values": {"length": {"lengthOf": "studyName", "plus": 9}, "origin": [{"type": "Derived", "source": "Sponsor"}]}},
    {"name": "SITEID", "description": "Estimate; Convention.", "values": {"length": 3, "origin": [{"type": "Assigned", "source": "Sponsor"}]}},
    {"name": "SUBJID", "description": "Estimate.", "values": {"length": 4}},
    {"name": "--SEQ", "description": "Estimate; Convention. From #4.", "values": {"length": 3, "origin": [{"type": "Derived", "source": "Sponsor"}]}},
    {"name": "--GRPID", "description": "Estimate; Convention. From #23.", "values": {"length": 10, "origin": [{"type": "Assigned", "source": "Sponsor"}]}},
    {"name": "--REFID", "description": "Estimate. From #22 (was REFID).", "values": {"length": 10}},
    {"name": "--LNKID", "description": "Estimate; Convention.", "values": {"length": 20, "origin": [{"type": "Assigned", "source": "Sponsor"}]}},
    {"name": "--LNKGRP", "description": "Estimate; Convention.", "values": {"length": 20, "origin": [{"type": "Assigned", "source": "Sponsor"}]}},
    {"name": "--FL", "description": "SDTMIG (a flag holds one character); Convention. From #14.", "values": {"length": 1, "origin": [{"type": "Derived", "source": "Sponsor"}]}},
    {"name": "VISITNUM", "description": "SDTMIG (Num); Estimate; Convention. From #6 and #15. Decimal unscheduled visits need float.", "values": {"dataType": "integer", "length": 2, "displayFormat": "Z2.", "origin": [{"type": "Assigned", "source": "Sponsor"}]}},
    {"name": "VISIT", "description": "Estimate; Convention.", "values": {"length": 40, "origin": [{"type": "Assigned", "source": "Sponsor"}]}},
    {"name": "VISITDY", "description": "SDTMIG (Num); Convention (the planned day comes from the protocol). Also keeps --DY off VISITDY.", "values": {"dataType": "integer", "length": 4, "origin": [{"type": "Protocol", "source": "Sponsor"}]}},
    {"name": "EPOCH", "excludeDomains": ["TA"], "description": "Estimate; Convention. In TA, EPOCH is part of the design and takes the trial design entry.", "values": {"length": 40, "origin": [{"type": "Derived", "source": "Sponsor"}]}},
    {"name": "--DY", "description": "SDTMIG (calculated from RFSTDTC; Num); Estimate. From #21; also covers --STDY (#5) and --ENDY.", "values": {"dataType": "integer", "length": 3, "origin": [{"type": "Derived", "source": "Sponsor"}]}},
    {"name": "--STRF", "description": "Estimate; Convention.", "values": {"length": 20, "origin": [{"type": "Derived", "source": "Sponsor"}]}},
    {"name": "--ENRF", "description": "Estimate; Convention.", "values": {"length": 20, "origin": [{"type": "Derived", "source": "Sponsor"}]}},
    {"name": "--DTC", "description": "Convention. From #19 (was XSDTC); #18 VSDTC merged into it.", "values": {"origin": [{"type": "Collected", "source": "Investigator"}]}},
    {"name": "--DTC", "domains": ["SE", "SV"], "description": "Convention (SE and SV are derived from other data).", "values": {"origin": [{"type": "Derived", "source": "Sponsor"}]}},
    {"name": "--DTC", "domains": ["LB", "MB"], "description": "Best guess (central lab). #17 LBDTC merged into it.", "values": {"origin": [{"type": "Collected", "source": "Vendor"}]}},
    {"name": "EXSTDTC", "description": "Convention (EX is copied from EC). From #20.", "values": {"origin": [{"type": "Predecessor", "source": "Sponsor"}]}},
    {"name": "EXENDTC", "description": "Convention (EX is copied from EC).", "values": {"origin": [{"type": "Predecessor", "source": "Sponsor"}]}},
    {"name": "RFSTDTC", "description": "Convention. Also keeps --DTC off them.", "values": {"origin": [{"type": "Derived", "source": "Sponsor"}]}},
    {"name": "RFENDTC", "description": "Convention. Also keeps --DTC off them.", "values": {"origin": [{"type": "Derived", "source": "Sponsor"}]}},
    {"name": "RFXSTDTC", "description": "Convention. Also keeps --DTC off them.", "values": {"origin": [{"type": "Derived", "source": "Sponsor"}]}},
    {"name": "RFXENDTC", "description": "Convention. Also keeps --DTC off them.", "values": {"origin": [{"type": "Derived", "source": "Sponsor"}]}},
    {"name": "RFICDTC", "description": "Convention. Also keeps --DTC off them.", "values": {"origin": [{"type": "Derived", "source": "Sponsor"}]}},
    {"name": "RFPENDTC", "description": "Convention. Also keeps --DTC off them.", "values": {"origin": [{"type": "Derived", "source": "Sponsor"}]}},
    {"name": "--TESTCD", "description": "SDTMIG (at most 8 characters); Convention. From #16 (length 20).", "values": {"length": 8, "origin": [{"type": "Assigned", "source": "Sponsor"}]}},
    {"name": "--TEST", "description": "SDTMIG (at most 40 characters); Convention. From #8 (length 24, no origin).", "values": {"length": 40, "origin": [{"type": "Assigned", "source": "Sponsor"}]}},
    {"name": "IETEST", "description": "SDTMIG (IETEST may be up to 200 characters).", "values": {"length": 200}},
    {"name": "--CAT", "description": "Estimate; Convention.", "values": {"length": 40, "origin": [{"type": "Assigned", "source": "Sponsor"}]}},
    {"name": "--SCAT", "description": "Estimate; Convention.", "values": {"length": 40, "origin": [{"type": "Assigned", "source": "Sponsor"}]}},
    {"name": "LBCAT", "description": "Estimate; Best guess (central lab). From #7.", "values": {"length": 20, "origin": [{"type": "Collected", "source": "Vendor"}]}},
    {"name": "--STRESC", "description": "Convention (standardized from --ORRES).", "values": {"origin": [{"type": "Derived", "source": "Sponsor"}]}},
    {"name": "--STRESN", "description": "Convention (standardized from --ORRES).", "values": {"origin": [{"type": "Derived", "source": "Sponsor"}]}},
    {"name": "--STRESU", "description": "Convention.", "values": {"origin": [{"type": "Assigned", "source": "Sponsor"}]}},
    {"name": "--STRESC", "domains": ["LB", "MB"], "description": "Best guess (the central lab sends standardized results).", "values": {"origin": [{"type": "Collected", "source": "Vendor"}]}},
    {"name": "--STRESN", "domains": ["LB", "MB"], "description": "Best guess (the central lab sends standardized results).", "values": {"origin": [{"type": "Collected", "source": "Vendor"}]}},
    {"name": "--STRESU", "domains": ["LB", "MB"], "description": "Best guess (the central lab sends standardized results).", "values": {"origin": [{"type": "Collected", "source": "Vendor"}]}},
    {"name": "--SPEC", "description": "Estimate.", "values": {"length": 40}},
    {"name": "--METHOD", "description": "Estimate.", "values": {"length": 40}},
    {"name": "--SPEC", "domains": ["LB", "MB"], "description": "Best guess (central lab).", "values": {"origin": [{"type": "Collected", "source": "Vendor"}]}},
    {"name": "--METHOD", "domains": ["LB", "MB"], "description": "Best guess (central lab).", "values": {"origin": [{"type": "Collected", "source": "Vendor"}]}},
    {"name": "--STAT", "description": "CT (NOT DONE).", "values": {"length": 8}},
    {"name": "--EVAL", "description": "Estimate; Convention.", "values": {"length": 40, "origin": [{"type": "Assigned", "source": "Sponsor"}]}},
    {"name": "--EVALID", "description": "Estimate; Convention.", "values": {"length": 20, "origin": [{"type": "Assigned", "source": "Sponsor"}]}},
    {"name": "--LOC", "description": "Estimate.", "values": {"length": 40}},
    {"name": "--LAT", "description": "Estimate.", "values": {"length": 20}},
    {"name": "--DIR", "description": "Estimate.", "values": {"length": 20}},
    {"name": "--POS", "description": "Estimate.", "values": {"length": 20}},
    {"name": "LBORNRLO", "description": "SDTMIG (Char, so not float); Estimate; Best guess (central lab). From #9 (dataType float and significantDigits removed).", "values": {"length": 6, "origin": [{"type": "Collected", "source": "Vendor"}]}},
    {"name": "LBORNRHI", "description": "SDTMIG (Char, so not float); Estimate; Best guess (central lab).", "values": {"length": 6, "origin": [{"type": "Collected", "source": "Vendor"}]}},
    {"name": "LBSTNRLO", "description": "SDTMIG (Num); Estimate; Best guess (central lab). significantDigits applies only to float.", "values": {"length": 6, "significantDigits": 2, "origin": [{"type": "Collected", "source": "Vendor"}]}},
    {"name": "LBSTNRHI", "description": "SDTMIG (Num); Estimate; Best guess (central lab). From #10 (dataType removed). significantDigits applies only to float.", "values": {"length": 6, "significantDigits": 2, "origin": [{"type": "Collected", "source": "Vendor"}]}},
    {"name": "LBSTNRC", "description": "SDTMIG (Char); Estimate; Best guess (central lab). From #11 (dataType removed).", "values": {"length": 19, "origin": [{"type": "Collected", "source": "Vendor"}]}},
    {"name": "LBNRIND", "description": "Estimate; Best guess (the central lab sends the flag). From #13 (was Assigned/Vendor).", "values": {"length": 20, "origin": [{"type": "Collected", "source": "Vendor"}]}},